{
  "$schema": "https://json-schema.org/draft/2020-12/schema",
  "$id": "https://modsecurity-connector.invalid/schemas/no-crs-case-catalog-v1.json",
  "title": "Canonical No-CRS case catalog",
  "type": "object",
  "required": ["schema_version", "catalog", "full_lifecycle_artifact_profile", "ruleset", "defaults", "cases"],
  "properties": {
    "schema_version": {"const": 1},
    "catalog": {"const": "no-crs-baseline"},
    "full_lifecycle_artifact_profile": {"const": "full_lifecycle"},
    "ruleset": {"type": "object"},
    "defaults": {"type": "object"},
    "cases": {
      "type": "array",
      "minItems": 1,
      "items": {
        "type": "object",
        "required": ["case_id", "title", "phase", "required_capabilities", "request", "expected_result", "expected_status", "expected_rule_id"],
        "allOf": [{"if": {"properties": {"case_id": {"enum": ["invalid_content_length","conflicting_content_length","duplicate_transfer_encoding","content_length_overflow","body_size_nonzero_with_null_data","header_count_nonzero_with_null_headers","event_metadata_truncation","event_json_limit","single_request_cleanup","multiple_sequential_requests","keep_alive_requests_if_supported","early_mapping_failure_cleanup","transaction_begin_failure_cleanup","finish_failure_propagation","clean_shutdown","phase4_marker_split_across_chunks","phase4_end_of_stream_evaluation","phase4_deny_after_commit_log_only_minimal","phase4_in_scope_content_type","phase4_content_type_with_charset","phase4_out_of_scope_content_type","phase4_missing_content_type","transport_http11_content_length","transport_http11_chunked","transport_keep_alive","transport_sequential_requests","phase4_body_at_limit","phase4_body_over_limit","phase4_body_process_partial","phase4_body_reject","full_lifecycle_event_metadata_bounded","phase4_strict_http1_client_abort","phase4_strict_host_survives","phase4_strict_followup_request_succeeds","keepalive_allow_allow","keepalive_allow_deny_allow","keepalive_safe_followup","keepalive_after_strict_new_connection","engine_timeout_before_commit","engine_timeout_after_commit","response_short_write_resume","response_write_would_block_resume"]}}}, "then": {"required": ["native_invocations"]}}, {"if": {"required": ["native_invocations"]}, "then": {"anyOf": [
          {"properties":{"case_id":{"const":"invalid_content_length"},"native_invocations":{"const":{"nginx":{"operation":"native_h1_parser_rejection","contract_case_id":"invalid_content_length"}}}}},
          {"properties":{"case_id":{"const":"conflicting_content_length"},"native_invocations":{"const":{"nginx":{"operation":"native_h1_parser_rejection","contract_case_id":"conflicting_content_length"}}}}},
          {"properties":{"case_id":{"const":"duplicate_transfer_encoding"},"native_invocations":{"const":{"nginx":{"operation":"native_h1_parser_rejection","contract_case_id":"duplicate_transfer_encoding"}}}}},
          {"properties":{"case_id":{"const":"content_length_overflow"},"native_invocations":{"const":{"nginx":{"operation":"native_h1_parser_rejection","contract_case_id":"content_length_overflow"}}}}},
          {"properties":{"case_id":{"const":"body_size_nonzero_with_null_data"},"native_invocations":{"const":{"nginx":{"operation":"common_mapper_input_fault","contract_case_id":"body_size_nonzero_with_null_data","expected_overrides":{"phase":1,"expected_status":500}}}}}},
          {"properties":{"case_id":{"const":"header_count_nonzero_with_null_headers"},"native_invocations":{"const":{"nginx":{"operation":"common_mapper_input_fault","contract_case_id":"header_count_nonzero_with_null_headers","expected_overrides":{"expected_status":500}}}}}},
          {"properties":{"case_id":{"const":"event_metadata_truncation"},"native_invocations":{"const":{"nginx":{"operation":"native_event_boundary_request","contract_case_id":"event_metadata_truncation"}}}}},
          {"properties":{"case_id":{"const":"event_json_limit"},"native_invocations":{"const":{"nginx":{"operation":"native_event_boundary_request","contract_case_id":"event_json_limit"}}}}},
          {"properties":{"case_id":{"const":"single_request_cleanup"},"native_invocations":{"const":{"nginx":{"operation":"request_sequence","contract_case_id":"single_request_cleanup"}}}}},
          {"properties":{"case_id":{"const":"multiple_sequential_requests"},"native_invocations":{"const":{"nginx":{"operation":"request_sequence","contract_case_id":"multiple_sequential_requests"}}}}},
          {"properties":{"case_id":{"const":"keep_alive_requests_if_supported"},"native_invocations":{"const":{"nginx":{"operation":"request_sequence","contract_case_id":"keep_alive_requests_if_supported"}}}}},
          {"properties":{"case_id":{"const":"early_mapping_failure_cleanup"},"native_invocations":{"const":{"nginx":{"operation":"request_sequence","contract_case_id":"early_mapping_failure_cleanup"}}}}},
          {"properties":{"case_id":{"const":"transaction_begin_failure_cleanup"},"native_invocations":{"const":{"nginx":{"operation":"request_sequence","contract_case_id":"transaction_begin_failure_cleanup"}}}}},
          {"properties":{"case_id":{"const":"finish_failure_propagation"},"native_invocations":{"const":{"nginx":{"operation":"request_sequence","contract_case_id":"finish_failure_propagation","expected_overrides":{"expected_status":200}}}}}},
          {"properties":{"case_id":{"const":"clean_shutdown"},"native_invocations":{"const":{"nginx":{"operation":"request_sequence","contract_case_id":"clean_shutdown","expected_overrides":{"expected_status":200}}}}}},
          {"properties":{"case_id":{"const":"phase4_marker_split_across_chunks"},"native_invocations":{"const":{"nginx":{"operation":"native_phase4_request","contract_case_id":"phase4_marker_split_across_chunks"}}}}},
          {"properties":{"case_id":{"const":"phase4_end_of_stream_evaluation"},"native_invocations":{"const":{"nginx":{"operation":"native_phase4_request","contract_case_id":"phase4_end_of_stream_evaluation","source_record_id":"phase4_marker_split_across_chunks"}}}}},
          {"properties":{"case_id":{"const":"phase4_deny_after_commit_log_only_minimal"},"native_invocations":{"const":{"nginx":{"operation":"native_phase4_request","contract_case_id":"phase4_deny_after_commit_log_only_minimal","expected_overrides":{"expected_status":200,"expected_result":"late_intervention_log_only_safe","nginx_phase4_mode":"safe"}}}}}},
          {"properties":{"case_id":{"const":"phase4_in_scope_content_type"},"native_invocations":{"const":{"nginx":{"operation":"native_phase4_request","contract_case_id":"phase4_in_scope_content_type"}}}}},
          {"properties":{"case_id":{"const":"phase4_content_type_with_charset"},"native_invocations":{"const":{"nginx":{"operation":"native_phase4_request","contract_case_id":"phase4_content_type_with_charset"}}}}},
          {"properties":{"case_id":{"const":"phase4_out_of_scope_content_type"},"native_invocations":{"const":{"nginx":{"operation":"native_phase4_request","contract_case_id":"phase4_out_of_scope_content_type","expected_overrides":{"expected_status":200,"expected_rule_id":null}}}}}},
          {"properties":{"case_id":{"const":"phase4_missing_content_type"},"native_invocations":{"const":{"nginx":{"operation":"native_phase4_request","contract_case_id":"phase4_missing_content_type","expected_overrides":{"expected_status":200,"expected_rule_id":null}}}}}},
          {"properties":{"case_id":{"const":"transport_http11_content_length"},"native_invocations":{"const":{"nginx":{"operation":"request_sequence","contract_case_id":"transport_http11_content_length"}}}}},
          {"properties":{"case_id":{"const":"transport_http11_chunked"},"native_invocations":{"const":{"nginx":{"operation":"request_sequence","contract_case_id":"transport_http11_chunked"}}}}},
          {"properties":{"case_id":{"const":"transport_keep_alive"},"native_invocations":{"const":{"nginx":{"operation":"request_sequence","contract_case_id":"transport_keep_alive"}}}}},
          {"properties":{"case_id":{"const":"transport_sequential_requests"},"native_invocations":{"const":{"nginx":{"operation":"request_sequence","contract_case_id":"transport_sequential_requests"}}}}},
          {"properties":{"case_id":{"const":"phase4_body_at_limit"},"native_invocations":{"const":{"nginx":{"operation":"native_phase4_request","contract_case_id":"phase4_body_at_limit"}}}}},
          {"properties":{"case_id":{"const":"phase4_body_over_limit"},"native_invocations":{"const":{"nginx":{"operation":"native_phase4_request","contract_case_id":"phase4_body_over_limit"}}}}},
          {"properties":{"case_id":{"const":"phase4_body_process_partial"},"native_invocations":{"const":{"nginx":{"operation":"native_phase4_request","contract_case_id":"phase4_body_process_partial"}}}}},
          {"properties":{"case_id":{"const":"phase4_body_reject"},"native_invocations":{"const":{"nginx":{"operation":"native_phase4_request","contract_case_id":"phase4_body_reject","expected_overrides":{"expected_status":200,"expected_rule_id":null,"expected_native_status":403,"expected_engine_error_class":"body_limit"}}}}}},
          {"properties":{"case_id":{"const":"full_lifecycle_event_metadata_bounded"},"native_invocations":{"const":{"nginx":{"operation":"native_phase4_request","contract_case_id":"full_lifecycle_event_metadata_bounded","source_record_id":"phase4_body_over_limit"}}}}},
          {"properties":{"case_id":{"const":"phase4_strict_http1_client_abort"},"native_invocations":{"const":{"nginx":{"operation":"request_sequence","contract_case_id":"phase4_strict_http1_client_abort"}}}}},
          {"properties":{"case_id":{"const":"phase4_strict_host_survives"},"native_invocations":{"const":{"nginx":{"operation":"request_sequence","contract_case_id":"phase4_strict_host_survives"}}}}},
          {"properties":{"case_id":{"const":"phase4_strict_followup_request_succeeds"},"native_invocations":{"const":{"nginx":{"operation":"request_sequence","contract_case_id":"phase4_strict_followup_request_succeeds"}}}}},
          {"properties":{"case_id":{"const":"keepalive_allow_allow"},"native_invocations":{"const":{"nginx":{"operation":"request_sequence","contract_case_id":"keepalive_allow_allow"}}}}},
          {"properties":{"case_id":{"const":"keepalive_allow_deny_allow"},"native_invocations":{"const":{"nginx":{"operation":"request_sequence","contract_case_id":"keepalive_allow_deny_allow"}}}}},
          {"properties":{"case_id":{"const":"keepalive_safe_followup"},"native_invocations":{"const":{"nginx":{"operation":"request_sequence","contract_case_id":"keepalive_safe_followup"}}}}},
          {"properties":{"case_id":{"const":"keepalive_after_strict_new_connection"},"native_invocations":{"const":{"nginx":{"operation":"request_sequence","contract_case_id":"keepalive_after_strict_new_connection"}}}}},
          {"properties":{"case_id":{"const":"engine_timeout_before_commit"},"native_invocations":{"const":{"nginx":{"operation":"request_sequence","contract_case_id":"engine_timeout_before_commit","expected_overrides":{"phase":1,"expected_status":504,"expected_rule_id":null,"expected_native_status":504,"expected_engine_error_class":"engine_timeout"}}}}}},
          {"properties":{"case_id":{"const":"engine_timeout_after_commit"},"native_invocations":{"const":{"nginx":{"operation":"request_sequence","contract_case_id":"engine_timeout_after_commit","expected_overrides":{"expected_status":200,"expected_rule_id":null,"expected_native_status":504,"expected_engine_error_class":"engine_timeout"}}}}}},
          {"properties":{"case_id":{"const":"response_short_write_resume"},"native_invocations":{"const":{"nginx":{"operation":"request_sequence","contract_case_id":"response_short_write_resume"}}}}},
          {"properties":{"case_id":{"const":"response_write_would_block_resume"},"native_invocations":{"const":{"nginx":{"operation":"request_sequence","contract_case_id":"response_write_would_block_resume"}}}}}
        ]}}],
        "properties": {
          "native_invocations": {"type":"object","required":["nginx"],"additionalProperties":false,"properties":{"nginx":{"type":"object","required":["operation","contract_case_id"],"additionalProperties":false,"properties":{"operation":{"enum":["native_h1_parser_rejection","common_mapper_input_fault","native_phase4_request","request_sequence","native_event_boundary_request"]},"contract_case_id":{"type":"string","enum":["invalid_content_length","conflicting_content_length","duplicate_transfer_encoding","content_length_overflow","body_size_nonzero_with_null_data","header_count_nonzero_with_null_headers","event_metadata_truncation","event_json_limit","single_request_cleanup","multiple_sequential_requests","keep_alive_requests_if_supported","early_mapping_failure_cleanup","transaction_begin_failure_cleanup","finish_failure_propagation","clean_shutdown","phase4_marker_split_across_chunks","phase4_end_of_stream_evaluation","phase4_deny_after_commit_log_only_minimal","phase4_in_scope_content_type","phase4_content_type_with_charset","phase4_out_of_scope_content_type","phase4_missing_content_type","transport_http11_content_length","transport_http11_chunked","transport_keep_alive","transport_sequential_requests","phase4_body_at_limit","phase4_body_over_limit","phase4_body_process_partial","phase4_body_reject","full_lifecycle_event_metadata_bounded","phase4_strict_http1_client_abort","phase4_strict_host_survives","phase4_strict_followup_request_succeeds","keepalive_allow_allow","keepalive_allow_deny_allow","keepalive_safe_followup","keepalive_after_strict_new_connection","engine_timeout_before_commit","engine_timeout_after_commit","response_short_write_resume","response_write_would_block_resume"]},"source_record_id":{"enum":["phase4_marker_split_across_chunks","phase4_body_over_limit"]},"expected_overrides":{"type":"object","additionalProperties":false,"properties":{"phase":{"type":"integer","const":1},"expected_status":{"type":["integer","null"]},"expected_rule_id":{"type":["integer","null"]},"expected_result":{"type":"string"},"expected_native_status":{"type":"integer"},"expected_engine_error_class":{"enum":["body_limit","engine_timeout"]},"nginx_phase4_mode":{"const":"safe"}}}}}}},
          "case_id": {"type": "string", "pattern": "^[a-z][a-z0-9_]+$"},
          "title": {"type": "string", "minLength": 1},
          "phase": {"type": "integer", "minimum": 0, "maximum": 5},
          "required_capabilities": {"type": "array", "minItems": 1, "items": {"type": "string"}, "uniqueItems": true},
          "request": {
            "type": "object",
            "properties": {
              "protocol_profile": {"enum": ["http1", "h2", "h2c", "h3"]},
              "protocol_operation": {"type": "string", "minLength": 1, "maxLength": 64, "pattern": "^[a-z][a-z0-9_]+$"},
              "stream_operation": {"type": "string", "minLength": 1, "maxLength": 64, "pattern": "^[a-z][a-z0-9_]+$"},
              "parallel_streams": {"type": "integer", "minimum": 2, "maximum": 64}
            }
          },
          "expected_result": {"type": "string", "minLength": 1},
          "expected_status": {"type": ["integer", "null"]},
          "expected_rule_id": {"type": ["integer", "null"]},
          "expected_event_fields": {"type": "array", "items": {"type": "string"}, "uniqueItems": true},
          "forbidden_event_fields": {"type": "array", "items": {"type": "string"}, "uniqueItems": true},
          "transport_hardening": {"type": "boolean"},
          "evidence_requirement": {
            "type": "object",
            "required": ["requires_real_host", "accepts_synthetic_pass"],
            "properties": {
              "requires_real_host": {"const": true},
              "accepts_synthetic_pass": {"const": false}
            }
          },
          "runner_case": {"type": "string", "minLength": 1},
          "deprecated_alias_for": {"type": "string", "pattern": "^[a-z][a-z0-9_]+$"}
        }
      }
    }
  }
}
