{
  "schema_version": 1,
  "catalog": "no-crs-baseline",
  "full_lifecycle_artifact_profile": "full_lifecycle",
  "ruleset": {
    "name": "no-crs-baseline",
    "path": "tests/rules/no-crs-baseline.conf",
    "reserved_rule_id_min": 1100001,
    "reserved_rule_id_max": 1100999
  },
  "defaults": {
    "connector_applicability": "capability_driven",
    "unsupported_behavior": "UNSUPPORTED",
    "evidence_requirement": {
      "requires_real_host": true,
      "accepts_synthetic_pass": false
    },
    "expected_event_fields": [],
    "forbidden_event_fields": [
      "request_body",
      "response_body",
      "matched_value",
      "rule_message",
      "intervention_log",
      "authorization",
      "cookie",
      "password",
      "secret"
    ]
  },
  "cases": [
    {"case_id":"allow_without_marker","title":"Allow a request without a baseline marker","group":"basic","phase":1,"required_capabilities":["request_headers","phase1"],"request":{"method":"GET","path":"/no-crs/allow","headers":[{"name":"X-Modsec-Smoke","value":"allow"}]},"expected_result":"allow","expected_status":200,"expected_rule_id":null,"runner_case":"allow_without_marker.yaml"},
    {"case_id":"deny_header_marker_403","title":"Deny the native phase-1 marker with HTTP 403","group":"basic","phase":1,"required_capabilities":["request_headers","phase1","deny"],"request":{"method":"GET","path":"/no-crs/deny","headers":[{"name":"X-Modsec-Smoke","value":"block"}]},"expected_result":"deny","expected_status":403,"expected_rule_id":1100001,"expected_event_fields":["connector","transaction_id","rule_id","phase","status"],"runner_case":"deny_header_marker_403.yaml"},
    {"case_id":"deny_with_alternative_status","title":"Deny with an alternative HTTP status","group":"basic","phase":1,"required_capabilities":["request_headers","phase1","deny"],"request":{"method":"GET","path":"/no-crs/alternative-status","headers":[{"name":"X-Modsec-Smoke","value":"alternative-status"}]},"expected_result":"deny","expected_status":429,"expected_rule_id":1100002,"expected_event_fields":["rule_id","phase","status"],"runner_case":"deny_with_alternative_status.yaml"},
    {"case_id":"transaction_id_present","title":"Preserve a supplied transaction identifier","group":"basic","phase":1,"required_capabilities":["transaction_id","phase1"],"request":{"method":"GET","path":"/no-crs/transaction-id","headers":[{"name":"X-Modsec-Transaction-Id","value":"no-crs-tx-0001"}]},"expected_result":"allow_with_event","expected_status":200,"expected_rule_id":1100003,"expected_event_fields":["transaction_id","rule_id"],"runner_case":"transaction_id_present.yaml"},
    {"case_id":"transaction_id_generated_or_fallback","title":"Generate or safely fall back to a transaction identifier","group":"basic","phase":1,"required_capabilities":["transaction_id","phase1"],"request":{"method":"GET","path":"/no-crs/generated-transaction-id"},"expected_result":"allow_with_transaction_id","expected_status":200,"expected_rule_id":1100502,"expected_event_fields":["transaction_id","rule_id","phase"],"runner_case":"transaction_id_generated_or_fallback.yaml"},
    {"case_id":"deny_request_body_marker_403","title":"Deny the buffered request-body marker in phase 2","group":"phase-capabilities","phase":2,"required_capabilities":["request_body_buffered","phase2","deny"],"request":{"method":"POST","path":"/no-crs/request-body","headers":[{"name":"Content-Type","value":"text/plain"}],"body_fixture":"no-crs-request-body-marker"},"expected_result":"deny","expected_status":403,"expected_rule_id":1100101,"expected_event_fields":["rule_id","phase","status"],"runner_case":"deny_request_body_marker_403.yaml"},
    {"case_id":"deny_response_header_marker_403","title":"Exercise a response-header rule in phase 3","group":"phase-capabilities","phase":3,"required_capabilities":["response_headers","phase3"],"request":{"method":"GET","path":"/no-crs/response-header","response_fixture":"X-Modsec-Upstream: block"},"expected_result":"deny_or_late_intervention","expected_status":403,"expected_rule_id":1100201,"expected_event_fields":["rule_id","phase","status"]},
    {"case_id":"deny_response_body_marker_403","title":"Deprecated alias for a pre-commit phase-4 HTTP 403 denial","group":"late-intervention","phase":4,"required_capabilities":["response_body_buffered","phase4","phase4_rule_evaluation","phase4_pre_commit_deny","deny","late_intervention_status_metadata","event_jsonl"],"request":{"method":"GET","path":"/no-crs/response-body","response_body_fixture":"no-crs-response-body-marker"},"expected_result":"legacy_phase4_deny_before_commit","expected_status":403,"expected_rule_id":1100301,"expected_event_fields":["event","message_id","rule_id","phase","http_status","requested_action","actual_action","original_http_status","visible_http_status","headers_sent","connection_aborted"],"deprecated_alias_for":"phase4_deny_before_commit"},
    {"case_id":"phase4_rule_observed","title":"Observe the response-body rule through a real phase-4 host path","group":"late-intervention","phase":4,"required_capabilities":["response_body_buffered","phase4","phase4_rule_evaluation","event_jsonl"],"request":{"method":"GET","path":"/no-crs/response-body","response_body_fixture":"no-crs-response-body-marker"},"expected_result":"rule_observed","expected_status":null,"expected_rule_id":1100301,"expected_event_fields":["event","message_id","rule_id","phase"]},
    {"case_id":"phase4_deny_before_commit","title":"Deny a phase-4 response before response commit","group":"late-intervention","phase":4,"required_capabilities":["response_body_buffered","phase4","phase4_rule_evaluation","phase4_pre_commit_deny","deny","late_intervention_status_metadata","event_jsonl"],"request":{"reuses":"phase4_rule_observed","intervention_mode":"pre_commit"},"expected_result":"deny_before_commit","expected_status":403,"expected_rule_id":1100301,"expected_event_fields":["event","message_id","rule_id","phase","http_status","requested_action","actual_action","original_http_status","visible_http_status","headers_sent","connection_aborted"],"runner_case":"deny_response_body_marker_403.yaml"},
    {"case_id":"phase4_deny_after_commit_log_only","title":"Record a committed phase-4 denial as log-only","group":"late-intervention","phase":4,"required_capabilities":["response_body_buffered","phase4","phase4_rule_evaluation","deny","late_intervention","late_intervention_log_only","late_intervention_status_metadata","event_jsonl"],"request":{"reuses":"phase4_rule_observed","intervention_mode":"log_only"},"expected_result":"late_intervention_log_only","expected_status":null,"expected_rule_id":1100301,"expected_event_fields":["event","message_id","rule_id","phase","http_status","requested_action","actual_action","original_http_status","visible_http_status","late_intervention","headers_sent","connection_aborted"]},
    {"case_id":"phase4_deny_after_commit_abort","title":"Abort a committed response after a phase-4 denial","group":"late-intervention","phase":4,"required_capabilities":["response_body_buffered","phase4","phase4_rule_evaluation","deny","late_intervention","late_intervention_abort","late_intervention_status_metadata","event_jsonl"],"request":{"reuses":"phase4_rule_observed","intervention_mode":"abort_connection"},"expected_result":"connection_aborted","expected_status":null,"expected_rule_id":1100301,"expected_event_fields":["event","message_id","rule_id","phase","http_status","requested_action","actual_action","original_http_status","visible_http_status","late_intervention","headers_sent","connection_aborted"]},
    {"case_id":"phase4_event_contains_original_status","title":"Distinguish WAF, original, and visible phase-4 statuses","group":"late-intervention","phase":4,"required_capabilities":["response_body_buffered","phase4","phase4_rule_evaluation","late_intervention_status_metadata","event_jsonl"],"request":{"reuses":"phase4_rule_observed"},"expected_result":"event_contains_original_status","expected_status":null,"expected_rule_id":1100301,"expected_event_fields":["event","message_id","rule_id","phase","http_status","original_http_status","visible_http_status"]},
    {"case_id":"phase4_event_contains_late_intervention_action","title":"Distinguish requested and actual phase-4 intervention actions","group":"late-intervention","phase":4,"required_capabilities":["response_body_buffered","phase4","phase4_rule_evaluation","late_intervention_status_metadata","event_jsonl"],"request":{"reuses":"phase4_rule_observed"},"expected_result":"event_contains_late_intervention_action","expected_status":null,"expected_rule_id":1100301,"expected_event_fields":["event","message_id","rule_id","phase","requested_action","actual_action","late_intervention"]},

    {"case_id":"multiple_headers","title":"Map multiple request headers","group":"headers","phase":1,"required_capabilities":["request_headers","phase1","event_jsonl"],"request":{"method":"GET","path":"/no-crs/headers/multiple","headers":[{"name":"X-No-Crs-A","value":"one"},{"name":"X-No-Crs-B","value":"two"}]},"expected_result":"allow","expected_status":200,"expected_rule_id":1100501,"expected_event_fields":["rule_id","phase"],"runner_case":"multiple_headers.yaml"},
    {"case_id":"duplicate_header_names","title":"Preserve duplicate request header names according to host semantics","group":"headers","phase":1,"required_capabilities":["request_headers","phase1","event_jsonl"],"request":{"method":"GET","path":"/no-crs/headers/duplicate","headers":[{"name":"X-No-Crs-Duplicate","value":"one"},{"name":"X-No-Crs-Duplicate","value":"two"}]},"expected_result":"allow_or_documented_host_normalization","expected_status":200,"expected_rule_id":1100504,"expected_event_fields":["rule_id","phase"],"runner_case":"duplicate_header_names.yaml"},